{
  "schema_version": "0.1",
  "evidence_id": "ev-observed-deployment-partial",
  "plane": "observed",
  "subject": {
    "system": "kubernetes",
    "cluster": "lab-k3s",
    "api_group": "apps",
    "kind": "Deployment",
    "namespace": "soria",
    "name": "api"
  },
  "existence": "PRESENT",
  "observation_status": "PARTIAL",
  "attempted_at": "2026-08-13T15:00:00Z",
  "observed_at": "2026-08-13T15:00:00Z",
  "expires_at": "2026-08-13T15:05:00Z",
  "data": {
    "desired_replicas": 2
  },
  "provenance": {
    "source_type": "kubernetes_api",
    "source_id": "lab-k3s",
    "collector": "kubernetes-observer",
    "collector_version": "0.1.0",
    "operation": "GET Deployment/soria/api plus related readiness fields"
  },
  "errors": [
    {
      "code": "RELATED_READINESS_UNAVAILABLE",
      "summary": "Readiness details could not be established for all related runtime objects."
    }
  ]
}
